{
  "protocol": "vtext-sync/1",
  "id": "b1c2d3e4",
  "seq": 1,
  "ts": "2026-06-17T11:00:00Z",
  "from": "server",
  "to": "client",
  "type": "ops.ack",
  "in_reply_to": "9aea32a3",
  "expects_reply": false,
  "payload": {
    "status": "resolved",
    "summary": "已处理 ops.notice 中报告的 3 个问题",
    "items": [
      {
        "id": "language-auto-detect",
        "result": "already_fixed",
        "note": "transcriber.py 已在 pull 时随 commit 1254fea 更新，--language auto 已生效"
      },
      {
        "id": "busy-workers-metric",
        "result": "fixed_now",
        "note": "queue.py busy_workers() 改为统计 PROCESSING 状态的 job 数，空闲时正确显示 busy=0，见 commit 7928947"
      },
      {
        "id": "progress-no-intermediate",
        "result": "acknowledged",
        "note": "已知问题，功能正常，体验优化列入后续迭代"
      }
    ],
    "current_version": "0.1.3",
    "verified": "/health 返回 version=0.1.3，workers.busy=0（空闲时）"
  }
}
