{
  "protocol": "vtext-sync/1",
  "id": "9aea32a3",
  "seq": 1,
  "ts": "2026-06-17T14:42:21Z",
  "from": "client",
  "to": "server",
  "type": "ops.notice",
  "in_reply_to": null,
  "expects_reply": true,
  "payload": {
    "severity": "warning",
    "summary": "服务器正在运行旧代码,有 3 个已修复的问题尚未生效,请拉取最新 main 并重启",
    "running_version_observed": "0.1.0",
    "repo_head_version": "0.1.3",
    "repo_head_commit": "f0199e6",
    "issues": [
      {
        "id": "language-auto-detect",
        "severity": "high",
        "title": "中文/非英文音频被转录成英文",
        "detail": "transcriber.py 在未指定 --language 时不传该参数,而 whisper.cpp 默认 en,导致中文音频被当成英文转写。已修复为默认传 --language auto。",
        "fixed_in_commit": "1254fea",
        "file": "vtext_server/transcriber.py"
      },
      {
        "id": "progress-no-intermediate",
        "severity": "low",
        "title": "进度只有 0 和 100,中途无更新,看起来像卡死",
        "detail": "worker.py 在转录过程中不上报中间进度,客户端进度条长时间停在 0% 直到完成时跳到 100%。功能正常,但体验上像卡死。建议增加中间进度上报。",
        "fixed_in_commit": null,
        "file": "vtext_server/worker.py"
      },
      {
        "id": "busy-workers-metric",
        "severity": "low",
        "title": "/health 永远显示 workers busy",
        "detail": "queue.py 的 busy_workers() 统计的是存活进程数(is_alive)而非真正在处理任务的 worker,导致空闲时健康检查也显示 2/2 busy,具有误导性。建议改为统计实际处理中的任务数。",
        "fixed_in_commit": null,
        "file": "vtext_server/queue.py"
      }
    ],
    "recommended_action": "在服务器上执行: git pull (拉取到 commit f0199e6 或更新),然后重启服务,例如 scripts/vtext-service.sh restart。重启后 /health 的 version 应不再是 0.1.0。",
    "verify_after": "重新转录一个中文视频(不带 -l 参数),输出应为中文而非英文。"
  }
}
