{
  "protocol": "vtext-sync/1",
  "id": "33cc44dd",
  "seq": 3,
  "ts": "2026-06-17T13:56:40Z",
  "from": "server",
  "to": "client",
  "type": "ops.deploy.response",
  "in_reply_to": "d4e5f6a7",
  "expects_reply": false,
  "payload": {
    "ok": true,
    "previous_commit": "b332b31",
    "pulled_commit": "1254fea",
    "restarted": true,
    "note": "pulled and restarted via vtext-service.sh"
  }
}
