{
  "protocol": "vtext-sync/1",
  "id": "22bb33cc",
  "seq": 2,
  "ts": "2026-06-17T13:50:18Z",
  "from": "server",
  "to": "client",
  "type": "ops.version.response",
  "in_reply_to": "c3d4e5f6",
  "expects_reply": false,
  "payload": {
    "version": "0.1.3",
    "git_commit": "1254fea",
    "git_branch": "main",
    "model": "small"
  }
}
