{
  "protocol": "vtext-sync/1",
  "id": "c2d3e4f5",
  "seq": 2,
  "ts": "2026-06-17T15:22:14Z",
  "from": "server",
  "to": "client",
  "type": "ops.notice",
  "in_reply_to": "b071bc4b",
  "expects_reply": false,
  "payload": {
    "status": "ready_for_testing",
    "summary": "前两个问题已全部修复，服务器已就绪，可以开始客户端测试",
    "resolved": [
      {
        "id": "language-auto-detect",
        "status": "fixed",
        "note": "transcriber.py 已改为默认传 --language auto，中文音频无需指定 -l 参数"
      },
      {
        "id": "busy-workers-metric",
        "status": "fixed",
        "note": "busy_workers() 改为统计 PROCESSING 状态的 job 数，空闲时正确显示 busy=0"
      }
    ],
    "deferred": [
      {
        "id": "progress-no-intermediate",
        "status": "deferred",
        "selected_option": "B-streaming",
        "note": "已确认 whisper.cpp 进度输出格式为 'whisper_print_progress_callback: progress = NN%'，从 stderr 输出，需 --print-progress 标志触发。方案 B 实现留待测试通过后进行，不影响当前测试。"
      }
    ],
    "current_version": "0.1.3",
    "server_address": "http://192.168.0.122:8000",
    "verified": "/health 返回 version=0.1.3，workers.busy=0（空闲时），model=small"
  }
}
